S127BAF06104,Purple Faux Leather Quilted Laptop Bag,http://zovi.com/womens-handbags?misc_ref_code=hp_seo_text,999,HANDBAGS,womens-handbags,zovi,http://d1n7si5t7mlegv.cloudfront.net/z/prod/w/2/g/p/S127BAF06104/1_c.jpg,999,,Women,http://zovi.com/purple-faux-leather-quilted-laptop-bag--S127BAF06104,zovi.com,Zovi Purple Faux Leather Quilted Laptop Bag - Zovi Womens Handbags,Zovi Purple Faux Leather Quilted Laptop Bag - Zovi Womens Handbags - Free Shipping. Easy Exchange. 30 Days Returns. Cash on Delivery.,['STD'],<section id="product-detail"> <h2 id="product-title">Purple Faux Leather Quilted Laptop Bag</h2> <p>Smart and Sassy quilted laptop bag with bright and causal color combination</p><ul><li><b>PU laptop bag with canvas strap.</b></li><li>Zipped quilted laptop bag with contrasting adjustable strap .</li><li>Across the body strap and inner zip pocket.</li><li>Can accommodate up to a 15 inches laptop.</li><li>Height: 13 inches; Width: 16.5 inches; Depth: 2 inches</li></ul> <label class="care"> Care Instructions<span class="down-arrow"></span> <section id="washcare"> <ul> <li>Do not wash</li> <li>Do not bleach</li> <li>Do not iron</li> <li>Do not tumble dry</li> <li>Do not dry clean</li> </ul> </section> </label> </section>,,14:04:2014,
A12BHBF02800,Light Blue Polka With Floral Print Canvas Bag,http://zovi.com/womens-handbags?misc_ref_code=hp_seo_text,629,HANDBAGS,womens-handbags,zovi,http://d1n7si5t7mlegv.cloudfront.net/z/prod/w/2/g/p/A12BHBF02800/1_c.jpg,629,blue,Women,http://zovi.com/light-blue-polka-with-floral-print-canvas-bag--A12BHBF02800,zovi.com,Zovi Light Blue Polka With Floral Print Canvas Bag - Zovi Womens Handbags,Zovi Light Blue Polka With Floral Print Canvas Bag - Zovi Womens Handbags - Free Shipping. Easy Exchange. 30 Days Returns. Cash on Delivery.,['STD'],<section id="product-detail"> <h2 id="product-title">Light Blue Polka With Floral Print Canvas Bag</h2> <p>A modern juxtaposed print handbag for women. The bag designed in canvas has overlapping polka and floral print with solid light blue adjustable shoulder strap and piping. The bag hangs extra stylishly from your shoulders to give a new look every day to your summer dresses and strappy heels.</p><b>Material: Canvas</b><br>Dimensions: Length: 24 cm|Height: 31 cm | Width: 14 cm |Handle Drop: 28 cm <label class="care"> Care Instructions<span class="down-arrow"></span> <section id="washcare"> <ul> <li>Do not wash</li> <li>Do not bleach</li> <li>Do not iron</li> <li>Do not tumble dry</li> <li>Do not dry clean</li> </ul> </section> </label> </br></section>,,14:04:2014,
A12BHBF02006,Flocked Light Olive Sling Bag,http://zovi.com/womens-handbags?misc_ref_code=hp_seo_text,674,HANDBAGS,womens-handbags,zovi,http://d2zfu6byxx4psc.cloudfront.net/z/prod/w/2/g/p/A12BHBF02006/1_c.jpg,674,green,Women,http://zovi.com/flocked-light-olive-sling-bag--A12BHBF02006,zovi.com,Zovi Flocked Light Olive Sling Bag - Zovi Womens Handbags,Zovi Flocked Light Olive Sling Bag - Zovi Womens Handbags - Free Shipping. Easy Exchange. 30 Days Returns. Cash on Delivery.,['STD'],<section id="product-detail"> <h2 id="product-title">Flocked Light Olive Sling Bag</h2> <p>This bag is designed with a single zip closer and a zip pocket as well. It is also crafted with a single flap pocket on front that is fitted with a magnet snap button closure. This sling bag is styled with canvas border on the top with black PU piping. It also flaunts black flock prints on a green/yellow hue. For added comfort this sling bag is crafted with an adjustable canvas handle that's stylish and easy to manoeuvre.</p><b>Material: Canvas</b><br>Dimensions: Length: 25.5 cm|Height: 22 cm | Width: 5.5 cm |Handle Drop: 35 cm <label class="care"> Care Instructions<span class="down-arrow"></span> <section id="washcare"> <ul> <li>Do not wash</li> <li>Do not bleach</li> <li>Do not iron</li> <li>Do not tumble dry</li> <li>Do not dry clean</li> </ul> </section> </label> </br></section>,,14:04:2014,
S137BAF12501,Red Messenger Bag With Fringe Detail,http://zovi.com/womens-handbags?misc_ref_code=hp_seo_text,809,HANDBAGS,womens-handbags,zovi,http://d1n7si5t7mlegv.cloudfront.net/z/prod/w/2/g/p/S137BAF12501/8_c.jpg,809,red,Women,http://zovi.com/red-messenger-bag-with-fringe-detail--S137BAF12501,zovi.com,Zovi Red Messenger Bag With Fringe Detail - Zovi Womens Handbags,Zovi Red Messenger Bag With Fringe Detail - Zovi Womens Handbags - Free Shipping. Easy Exchange. 30 Days Returns. Cash on Delivery.,['STD'],<section id="product-detail"> <h2 id="product-title">Red Messenger Bag With Fringe Detail</h2> <p>A sensuous red colour messenger bag for women. The messenger bag features a boxy silhouette and front pocket with magnetic clasp. The front pocket flap has stylish fringe details with studs. It has an adjustable shoulder strap.</p><b>Material: PU with Polyester Lining</b><br>Dimensions (cms): Length - 27.5; Height-18.5; Width: 7 | Strap Height-130 <label class="care"> Care Instructions<span class="down-arrow"></span> <section id="washcare"> <ul> <li>Do not wash</li> <li>Do not bleach</li> <li>Do not iron</li> <li>Do not tumble dry</li> <li>Do not dry clean</li> </ul> </section> </label> </br></section>,,14:04:2014,
S127BAF06103,Red Faux Leather Quilted Laptop Bag,http://zovi.com/womens-handbags?misc_ref_code=hp_seo_text,999,HANDBAGS,womens-handbags,zovi,http://d1yvqnuw46gd8y.cloudfront.net/z/prod/w/2/g/p/S127BAF06103/7_c.jpg,999,,Women,http://zovi.com/red-faux-leather-quilted-laptop-bag--S127BAF06103,zovi.com,Zovi Red Faux Leather Quilted Laptop Bag - Zovi Womens Handbags,Zovi Red Faux Leather Quilted Laptop Bag - Zovi Womens Handbags - Free Shipping. Easy Exchange. 30 Days Returns. Cash on Delivery.,['STD'],<section id="product-detail"> <h2 id="product-title">Red Faux Leather Quilted Laptop Bag</h2> <p>Smart and Sassy quilted laptop bag with bright and causal color combination</p><ul><li><b>PU laptop bag with canvas strap.</b></li><li>Zipped quilted laptop bag with contrasting adjustable strap .</li><li>Across the body strap and inner zip pocket.</li><li>Can accommodate up to a 15 inches laptop.</li><li>Height: 13 inches; Width: 16.5 inches; Depth: 2 inches</li></ul> <label class="care"> Care Instructions<span class="down-arrow"></span> <section id="washcare"> <ul> <li>Do not wash</li> <li>Do not bleach</li> <li>Do not iron</li> <li>Do not tumble dry</li> <li>Do not dry clean</li> </ul> </section> </label> </section>,,14:04:2014,
S127BAF06501,Black Faux Leather Quilted Handbag,http://zovi.com/womens-handbags?misc_ref_code=hp_seo_text,999,HANDBAGS,womens-handbags,zovi,http://d1yvqnuw46gd8y.cloudfront.net/z/prod/w/2/g/p/S127BAF06501/2_c.jpg,999,,Women,http://zovi.com/black-faux-leather-quilted-handbag--S127BAF06501,zovi.com,Zovi Black Faux Leather Quilted Handbag - Zovi Womens Handbags,Zovi Black Faux Leather Quilted Handbag - Zovi Womens Handbags - Free Shipping. Easy Exchange. 30 Days Returns. Cash on Delivery.,['STD'],<section id="product-detail"> <h2 id="product-title">Black Faux Leather Quilted Handbag</h2> <p>A chic weekday to weekend quilted faux leather handbag. Polyurethane ( PU ) handbag. Quilted handbag with contrast lining inside. Sling Strap with inner zip pockets.</p>Dimensions- 22 cms (H) X 35 cms (W); strap length 56 cms approximately. <label class="care"> Care Instructions<span class="down-arrow"></span> <section id="washcare"> <ul> <li>Do not wash</li> <li>Do not bleach</li> <li>Do not iron</li> <li>Do not tumble dry</li> <li>Do not dry clean</li> </ul> </section> </label> </section>,,14:04:2014,
S127BAF06101,Green Faux Leather Quilted Laptop Bag,http://zovi.com/womens-handbags?misc_ref_code=hp_seo_text,999,HANDBAGS,womens-handbags,zovi,http://d1yvqnuw46gd8y.cloudfront.net/z/prod/w/2/g/p/S127BAF06101/7_c.jpg,999,,Women,http://zovi.com/green-faux-leather-quilted-laptop-bag--S127BAF06101,zovi.com,Zovi Green Faux Leather Quilted Laptop Bag - Zovi Womens Handbags,Zovi Green Faux Leather Quilted Laptop Bag - Zovi Womens Handbags - Free Shipping. Easy Exchange. 30 Days Returns. Cash on Delivery.,['STD'],<section id="product-detail"> <h2 id="product-title">Green Faux Leather Quilted Laptop Bag</h2> <p>Smart and Sassy quilted laptop bag with bright and causal color combination</p><ul><li><b>PU laptop bag with canvas strap.</b></li><li>Zipped quilted laptop bag with contrasting adjustable strap .</li><li>Across the body strap and inner zip pocket.</li><li>Can accommodate up to a 15 inches laptop.</li><li>Height: 13 inches; Width: 16.5 inches; Depth: 2 inches</li></ul> <label class="care"> Care Instructions<span class="down-arrow"></span> <section id="washcare"> <ul> <li>Do not wash</li> <li>Do not bleach</li> <li>Do not iron</li> <li>Do not tumble dry</li> <li>Do not dry clean</li> </ul> </section> </label> </section>,,14:04:2014,
