A137FLF00103,Orange Textured Flip Flops,http://zovi.com/zovi-edge-collection?misc_ref_code=hp_seo_text,179,ZOVI EDGE,womens-flipflops,zovi,http://d1yvqnuw46gd8y.cloudfront.net/z/prod/w/2/g/p/A137FLF00103/1_c.jpg,179,orange,Men,http://zovi.com/orange-textured-flip-flops--A137FLF00103,zovi.com,Zovi Orange Textured Flip Flops - Zovi Womens Flipflops,Zovi Orange Textured Flip Flops - Zovi Womens Flipflops - Free Shipping. Easy Exchange. 30 Days Returns. Cash on Delivery.,[],<section id="product-detail"> <h2 id="product-title">Orange Textured Flip Flops</h2> <p>A comfortable and flexible pair of flip flops for a tropical destination. This perfect pick for a day at the beach or for a walk on the boulevard  has a orange colour textured base. Pair these flip flops with shorts and tees for a relaxed holiday look. </p><b>Material: EVA</b> <label class="care"> Care Instructions<span class="down-arrow"></span> <section id="washcare"> <ul> <li>Wipe surface with soft  clean  dry cloth / sponge to remove dust.</li> <li>Do not machine wash.</li> </ul> </section> </label> </section>,,14:04:2014,
S12PPRM09106,Dark Green Yellow Mens Stretch Tee,http://zovi.com/zovi-edge-collection?misc_ref_code=hp_seo_text,599,ZOVI EDGE,mens-fashion-solid-tees,zovi,http://d1yvqnuw46gd8y.cloudfront.net/z/prod/w/2/g/p/S12PPRM09106/7_c.jpg,599,green,Men,http://zovi.com/dark-green-yellow-mens-stretch-tee--S12PPRM09106,zovi.com,Zovi Dark Green Yellow Mens Stretch Tee - Zovi Mens Fashion Solid Tees,Zovi Dark Green Yellow Mens Stretch Tee - Zovi Mens Fashion Solid Tees - Free Shipping. Easy Exchange. 30 Days Returns. Cash on Delivery.,[],<section id="product-detail"> <h2 id="product-title">Dark Green Yellow Mens Stretch Tee</h2> <p>A dark green t-shirt for men. The solid green t-shirt features a fine yellow piping and at neckline at cuffs that adds an attitude for you. Style the round neck t-shirt with denims as you go out to catch the weather report.</p><b>Fabric: Super combed cotton elastane</b> <label class="care"> Care Instructions<span class="down-arrow"></span> <section id="washcare"> <ul> <li>Warm wash under 30 C</li> <li>Do not bleach</li> <li>Do not dry clean</li> <li>Do not tumble dry</li> <li>Dry Flat in shade</li> <li>Warm Iron</li> <li>Do not wring</li> </ul> </section> </label> </section>,,14:04:2014,
A137SHM14501,Silver And Neon Green Enhancer Sports Shoes,http://zovi.com/zovi-edge-collection?misc_ref_code=hp_seo_text,499,ZOVI EDGE,mens-sports-shoes,zovi,http://d1n7si5t7mlegv.cloudfront.net/z/prod/w/2/g/p/A137SHM14501/1_c.jpg,499,gray,Men,http://zovi.com/silver-and-neon-green-enhancer-sports-shoes--A137SHM14501,zovi.com,Zovi Silver And Neon Green Enhancer Sports Shoes - Zovi Mens Sports Shoes,Zovi Silver And Neon Green Enhancer Sports Shoes - Zovi Mens Sports Shoes - Free Shipping. Easy Exchange. 30 Days Returns. Cash on Delivery.,[],<section id="product-detail"> <h2 id="product-title">Silver And Neon Green Enhancer Sports Shoes</h2> <p>The right sport shoes are a must have for comfort and style. These here are silver mesh shoes with neon green accents and a design features on the quarter. The shoe features comfortable cushion for stress free active wear. This pair has a mesh tongue  and blue vertical accents on the quarter. Your quest for the trendiest sport shoes are over  with this pair.</p><b>Material: Upper – Mesh &amp; Synthetic | Sole - EVA</b> <label class="care"> Care Instructions<span class="down-arrow"></span> <section id="washcare"> <ul> <li>Wet wipe with light detergent</li> <li>Machine wash is not reccomended</li> </ul> </section> </label> </section>,,14:04:2014,
S147SHM00601,White And Black Matrix Quarter Sports Shoes,http://zovi.com/zovi-edge-collection?misc_ref_code=hp_seo_text,499,ZOVI EDGE,mens-sports-shoes,zovi,http://d1yvqnuw46gd8y.cloudfront.net/z/prod/w/2/g/p/S147SHM00601/1_c.jpg,499,black,Men,http://zovi.com/white-and-black-matrix-quarter-sports-shoes--S147SHM00601,zovi.com,Zovi White And Black Matrix Quarter Sports Shoes - Zovi Mens Sports Shoes,Zovi White And Black Matrix Quarter Sports Shoes - Zovi Mens Sports Shoes - Free Shipping. Easy Exchange. 30 Days Returns. Cash on Delivery.,[],<section id="product-detail"> <h2 id="product-title">White And Black Matrix Quarter Sports Shoes</h2> <p>Enhance your performance while not compromising on style and comfort with a pair of exciting new sport shoes. This low cut pair has been designed with a black upper along with white laces  outersole and grey collar. The quarter has a Matrix style design element. The inner sole has been designed for comfort and stress free movement to give your foot ultimate ease. These shoes have been created for all round activities and comfort  to be worn with shorts and an absorbent tee. </p><b>Material: Upper – Mesh &amp; Synthetic | Sole - EVA</b> <label class="care"> Care Instructions<span class="down-arrow"></span> <section id="washcare"> <ul> <li>Wet wipe with light detergent</li> <li>Machine wash is not reccomended</li> </ul> </section> </label> </section>,,14:04:2014,
A137SHM2D401,Navy Slip On Casual Shoes With Suede Backstay,http://zovi.com/zovi-edge-collection?misc_ref_code=hp_seo_text,499,ZOVI EDGE,mens-loafers-shoes,zovi,http://d1yvqnuw46gd8y.cloudfront.net/z/prod/w/2/g/p/A137SHM2D401/1_c.jpg,499,blue,Men,http://zovi.com/navy-slip-on-casual-shoes-with-suede-backstay--A137SHM2D401,zovi.com,Zovi Navy Slip On Casual Shoes With Suede Backstay - Zovi Mens Loafers Shoes,Zovi Navy Slip On Casual Shoes With Suede Backstay - Zovi Mens Loafers Shoes - Free Shipping. Easy Exchange. 30 Days Returns. Cash on Delivery.,[],<section id="product-detail"> <h2 id="product-title">Navy Slip On Casual Shoes With Suede Backstay</h2> <p>Be the pacesetter amongst your peers in shoes that support the feet of born fashion leaders. This pair of navy faux leather slip on shoes features white thread cut and sew detailing along with a navy suede backstay. The inner sole has been designed for comfort and stress free movement to give your foot ultimate ease. Lounge around or be meeting ready in these shoes  with brown trousers and a white shirt.</p><b>Material: Upper - Synthetic | Sole - Airmax</b> <label class="care"> Care Instructions<span class="down-arrow"></span> <section id="washcare"> <ul> <li>Always apply the matching color polish to your shoes.</li> <li>Use solvent based suede cleaner to remove stains.</li> <li>Use toothbrush  mild soap and water to clean Sneakers made from canvas.</li> <li>If you are in bit hurry  remove excess dirt with a cloth and/or a brush and then apply the liquid shine evenly to your shoes.</li> <li>To retain the shape of shoes  store them using a shoe tree. In case you don't have shoe tree  stuff the toe cap with newspaper or tissue.</li> <li>Never store leather shoes near direct heat.</li> <li>If your shoes get wet  allow them to dry completely before wearing them again.</li> </ul> </section> </label> </section>,,14:04:2014,
S147SHM00501,Royal Blue  Silver And Black Sports Shoes,http://zovi.com/zovi-edge-collection?misc_ref_code=hp_seo_text,499,ZOVI EDGE,mens-sports-shoes,zovi,http://d2zfu6byxx4psc.cloudfront.net/z/prod/w/2/g/p/S147SHM00501/1_c.jpg,499,blue,Men,http://zovi.com/royal-blue-silver-and-black-sports-shoes--S147SHM00501,zovi.com,Zovi Royal Blue  Silver And Black Sports Shoes - Zovi Mens Sports Shoes,Zovi Royal Blue  Silver And Black Sports Shoes - Zovi Mens Sports Shoes - Free Shipping. Easy Exchange. 30 Days Returns. Cash on Delivery.,[],<section id="product-detail"> <h2 id="product-title">Royal Blue  Silver And Black Sports Shoes</h2> <p>Casual and comfortable shoes set the pace right. Here are white sports shoes with comfortable cushion for stress free active wear. The shoes feature lace detailing and stylized navy and grey accents. The shoes are also designed with maximum grip along the stylized soles. Match your attitude with these trend setting shoes.</p><b>Material: Upper - Mesh | Sole - EVA</b> <label class="care"> Care Instructions<span class="down-arrow"></span> <section id="washcare"> <ul> <li>Wet wipe with light detergent</li> <li>Machine wash is not reccomended</li> </ul> </section> </label> </section>,,14:04:2014,
A133RNM45A01,Pink Face Black Graphic T-shirt,http://zovi.com/zovi-edge-collection?misc_ref_code=hp_seo_text,299,ZOVI EDGE,mens-graphic-round-necks,zovi,http://d1n7si5t7mlegv.cloudfront.net/z/prod/w/2/g/p/A133RNM45A01/1_c.jpg,299,black,Men,http://zovi.com/pink-face-black-graphic-t-shirt--A133RNM45A01,zovi.com,Zovi Pink Face Black Graphic T-shirt - Zovi Mens Graphic Round Necks,Zovi Pink Face Black Graphic T-shirt - Zovi Mens Graphic Round Necks - Free Shipping. Easy Exchange. 30 Days Returns. Cash on Delivery.,[],<section id="product-detail"> <h2 id="product-title">Pink Face Black Graphic T-shirt</h2> <p>Stand out and rock this t-shirt on your next backpacking adventure. Pair this tee with shorts during the day or combine it with torn jeans to pull off the rugged explorer look. This black; round neck; half sleeves; cotton t-shirt has a Pink Face graphi <label class="care"> Care Instructions<span class="down-arrow"></span> <section id="washcare"> <ul> <li>Warm wash under 30 C</li> <li>Do not bleach</li> <li>Do not dry clean</li> <li>Do not tumble dry</li> <li>Dry Flat in shade</li> <li>Warm Iron</li> <li>Do not wring</li> </ul> </section> </label> </p></section>,,14:04:2014,
A137SLF02801,Silver With Black Diamond Shaped Lightweight Closed Casual Shoes,http://zovi.com/zovi-edge-collection?misc_ref_code=hp_seo_text,349,ZOVI EDGE,womens-casual-shoes,zovi,http://d2zfu6byxx4psc.cloudfront.net/z/prod/w/2/g/p/A137SLF02801/1_c.jpg,349,black,Men,http://zovi.com/silver-with-black-diamond-shaped-lightweight-closed-casual-shoes--A137SLF02801,zovi.com,Zovi Silver With Black Diamond Shaped Lightweight Closed Casual Shoes - Zovi Womens Casual Shoes,Zovi Silver With Black Diamond Shaped Lightweight Closed Casual Shoes - Zovi Womens Casual Shoes - Free Shipping. Easy Exchange. 30 Days Returns. Cash on Delivery.,[],<section id="product-detail"> <h2 id="product-title">Silver With Black Diamond Shaped Lightweight Closed Casual Shoes</h2> <p> Flaunt you femininity and cover those elegant feet in these snug and plush flats. These extremely flexible flats are designed with a silver and black diamond shaped upper and closed backs. The heel measures upto 2 cm and the outersole is black in colour. With ethnic or western clothes  these lightweight flats will draw the attention of all surrounding you.</p><b>Material: Upper - Fabric | Sole - PU</b> <label class="care"> Care Instructions<span class="down-arrow"></span> <section id="washcare"> <ul> <li>Wipe surface with soft  clean  dry cloth / sponge to remove dust.</li> <li>Do not machine wash.</li> </ul> </section> </label> </section>,,14:04:2014,
A137SHM14601,Grey Sports Shoes With Stylized Blue Accents,http://zovi.com/zovi-edge-collection?misc_ref_code=hp_seo_text,499,ZOVI EDGE,mens-sports-shoes,zovi,http://d1yvqnuw46gd8y.cloudfront.net/z/prod/w/2/g/p/A137SHM14601/1_c.jpg,499,gray,Men,http://zovi.com/grey-sports-shoes-with-stylized-blue-accents--A137SHM14601,zovi.com,Zovi Grey Sports Shoes With Stylized Blue Accents - Zovi Mens Sports Shoes,Zovi Grey Sports Shoes With Stylized Blue Accents - Zovi Mens Sports Shoes - Free Shipping. Easy Exchange. 30 Days Returns. Cash on Delivery.,[],<section id="product-detail"> <h2 id="product-title">Grey Sports Shoes With Stylized Blue Accents</h2> <p>Casual and comfortable shoes set the pace right. Here are grey sports shoes with comfortable cushion for stress free active wear. The shoes feature blue lace detailing and stylized side accents. The shoes are also designed with maximum grip along the stylized blue soles. Match your attitude with these trend setting shoes.</p><b>Material: Upper - Mesh and Synthetic | Sole - EVA</b> <label class="care"> Care Instructions<span class="down-arrow"></span> <section id="washcare"> <ul> <li>Wet wipe with light detergent</li> <li>Machine wash is not reccomended</li> </ul> </section> </label> </section>,,14:04:2014,
A137SLF02501,Purple With Black Ethnic Design Lightweight Slip-on Shoes,http://zovi.com/zovi-edge-collection?misc_ref_code=hp_seo_text,349,ZOVI EDGE,womens-flats-and-ballerinas,zovi,http://d1yvqnuw46gd8y.cloudfront.net/z/prod/w/2/g/p/A137SLF02501/1_c.jpg,349,purple,Men,http://zovi.com/purple-with-black-ethnic-design-lightweight-slip-on-shoes--A137SLF02501,zovi.com,Zovi Purple With Black Ethnic Design Lightweight Slip-on Shoes - Zovi Womens Flats And Ballerinas,Zovi Purple With Black Ethnic Design Lightweight Slip-on Shoes - Zovi Womens Flats And Ballerinas - Free Shipping. Easy Exchange. 30 Days Returns. Cash on Delivery.,[],<section id="product-detail"> <h2 id="product-title">Purple With Black Ethnic Design Lightweight Slip-on Shoes</h2> <p> Flaunt you femininity and cover those elegant feet in these snug and plush flats. These extremely flexible flats are designed with a purple upper with a black ethnic design and open backs. The heel measures upto 2 cm and the outersole is black in colour. With ethnic or western clothes  these lightweight flats will draw the attention of all surrounding you.</p><b>Material: Upper - Fabric | Sole - PU</b> <label class="care"> Care Instructions<span class="down-arrow"></span> <section id="washcare"> <ul> <li>Wipe surface with soft  clean  dry cloth / sponge to remove dust.</li> <li>Do not machine wash.</li> </ul> </section> </label> </section>,,14:04:2014,
A133RNM0EC30,Brown Melange Round Neck T-shirt,http://zovi.com/zovi-edge-collection?misc_ref_code=hp_seo_text,249,ZOVI EDGE,mens-fashion-solid-tees,zovi,http://d1yvqnuw46gd8y.cloudfront.net/z/prod/w/2/g/p/A133RNM0EC30/1_c.jpg,249,brown,Men,http://zovi.com/brown-melange-round-neck-t-shirt--A133RNM0EC30,zovi.com,Zovi Brown Melange Round Neck T-shirt - Zovi Mens Fashion Solid Tees,Zovi Brown Melange Round Neck T-shirt - Zovi Mens Fashion Solid Tees - Free Shipping. Easy Exchange. 30 Days Returns. Cash on Delivery.,[],<section id="product-detail"> <h2 id="product-title">Brown Melange Round Neck T-shirt</h2> <p>A solid brown melange colour round neck t-shirt for men. The coloured tee features round neck and short sleeves. Style the t-shirt in summer a jacket and loafers with your favourite denims.</p><b>Fabric: 100% Cotton/Polyester</b> <label class="care"> Care Instructions<span class="down-arrow"></span> <section id="washcare"> <ul> <li>Warm wash under 30 C</li> <li>Do not bleach</li> <li>Do not dry clean</li> <li>Do not tumble dry</li> <li>Dry Flat in shade</li> <li>Warm Iron</li> <li>Do not wring</li> </ul> </section> </label> </section>,,14:04:2014,
A137SHM44B01,Black Low Cut Casual Sneakers With Singular Red Stripe,http://zovi.com/zovi-edge-collection?misc_ref_code=hp_seo_text,499,ZOVI EDGE,mens-sneakers-shoes,zovi,http://d1n7si5t7mlegv.cloudfront.net/z/prod/w/2/g/p/A137SHM44B01/1_c.jpg,499,black,Men,http://zovi.com/black-low-cut-casual-sneakers-with-singular-red-stripe--A137SHM44B01,zovi.com,Zovi Black Low Cut Casual Sneakers With Singular Red Stripe - Zovi Mens Sneakers Shoes,Zovi Black Low Cut Casual Sneakers With Singular Red Stripe - Zovi Mens Sneakers Shoes - Free Shipping. Easy Exchange. 30 Days Returns. Cash on Delivery.,[],<section id="product-detail"> <h2 id="product-title">Black Low Cut Casual Sneakers With Singular Red Stripe</h2> <p>Born to be young  free and wild in this pair of outrageously cool shoes. This low cut pair has been designed with black canvas on the upper  white laces and white stitch details. These shoes have a red faux leather stripe extended onto the quarter. The inner sole has been designed for comfort and stress free movement to give your foot ultimate ease. These plush shoes are best worn with casual attire and sunglasses under the sun.</p><b>Material: Upper - Canvas | Sole - Air Max</b> <label class="care"> Care Instructions<span class="down-arrow"></span> <section id="washcare"> <ul> <li>Always apply the matching color polish to your shoes.</li> <li>Use solvent based suede cleaner to remove stains.</li> <li>Use toothbrush  mild soap and water to clean Sneakers made from canvas.</li> <li>If you are in bit hurry  remove excess dirt with a cloth and/or a brush and then apply the liquid shine evenly to your shoes.</li> <li>To retain the shape of shoes  store them using a shoe tree. In case you don't have shoe tree  stuff the toe cap with newspaper or tissue.</li> <li>Never store leather shoes near direct heat.</li> <li>If your shoes get wet  allow them to dry completely before wearing them again.</li> </ul> </section> </label> </section>,,14:04:2014,
A137SHM35001,Sea Green Faux Leather Loafer Casual Shoes,http://zovi.com/zovi-edge-collection?misc_ref_code=hp_seo_text,499,ZOVI EDGE,mens-loafers-shoes,zovi,http://d2zfu6byxx4psc.cloudfront.net/z/prod/w/2/g/p/A137SHM35001/1_c.jpg,499,green,Men,http://zovi.com/sea-green-faux-leather-loafer-casual-shoes--A137SHM35001,zovi.com,Zovi Sea Green Faux Leather Loafer Casual Shoes - Zovi Mens Loafers Shoes,Zovi Sea Green Faux Leather Loafer Casual Shoes - Zovi Mens Loafers Shoes - Free Shipping. Easy Exchange. 30 Days Returns. Cash on Delivery.,[],<section id="product-detail"> <h2 id="product-title">Sea Green Faux Leather Loafer Casual Shoes</h2> <p> A pair of trendsetting sporty loafer shoes for men. These shoes are finely designed with sea green fauz leather and white thread detailing all across. The back quarter is styles with an elongated flap. These shoes have a comfortable sole with a white Airmax outersole. Get ready to rock these shoes with torn denims and a graphic tee. </p><b>Material: Upper - Faux Leather | Sole - Air Max</b> <label class="care"> Care Instructions<span class="down-arrow"></span> <section id="washcare"> <ul> <li>Always apply the matching color polish to your shoes.</li> <li>Use solvent based suede cleaner to remove stains.</li> <li>Use toothbrush  mild soap and water to clean Sneakers made from canvas.</li> <li>If you are in bit hurry  remove excess dirt with a cloth and/or a brush and then apply the liquid shine evenly to your shoes.</li> <li>To retain the shape of shoes  store them using a shoe tree. In case you don't have shoe tree  stuff the toe cap with newspaper or tissue.</li> <li>Never store leather shoes near direct heat.</li> <li>If your shoes get wet  allow them to dry completely before wearing them again.</li> </ul> </section> </label> </section>,,14:04:2014,
A137SHM45C01,Red Low Cut Casual Sneakers With Singular Green Stripe,http://zovi.com/zovi-edge-collection?misc_ref_code=hp_seo_text,299,ZOVI EDGE,mens-sneakers-shoes,zovi,http://d1n7si5t7mlegv.cloudfront.net/z/prod/w/2/g/p/A137SHM45C01/1_c.jpg,299,red,Men,http://zovi.com/red-low-cut-casual-sneakers-with-singular-green-stripe--A137SHM45C01,zovi.com,Zovi Red Low Cut Casual Sneakers With Singular Green Stripe - Zovi Mens Sneakers Shoes,Zovi Red Low Cut Casual Sneakers With Singular Green Stripe - Zovi Mens Sneakers Shoes - Free Shipping. Easy Exchange. 30 Days Returns. Cash on Delivery.,[],<section id="product-detail"> <h2 id="product-title">Red Low Cut Casual Sneakers With Singular Green Stripe</h2> <p>Born to be young  free and wild in this pair of outrageously cool shoes. This low cut pair has been designed with red canvas on the upper  white laces and white stitch details. These shoes have a green faux leather stripe extended onto the quarter. The inner sole has been designed for comfort and stress free movement to give your foot ultimate ease. These plush shoes are best worn with casual attire and sunglasses under the sun.</p><b>Material: Upper - Canvas | Sole - Air Max</b> <label class="care"> Care Instructions<span class="down-arrow"></span> <section id="washcare"> <ul> <li>Always apply the matching color polish to your shoes.</li> <li>Use solvent based suede cleaner to remove stains.</li> <li>Use toothbrush  mild soap and water to clean Sneakers made from canvas.</li> <li>If you are in bit hurry  remove excess dirt with a cloth and/or a brush and then apply the liquid shine evenly to your shoes.</li> <li>To retain the shape of shoes  store them using a shoe tree. In case you don't have shoe tree  stuff the toe cap with newspaper or tissue.</li> <li>Never store leather shoes near direct heat.</li> <li>If your shoes get wet  allow them to dry completely before wearing them again.</li> </ul> </section> </label> </section>,,14:04:2014,
A137SLF02701,Black With Grey Square Design Lightweight Slip-on Shoes,http://zovi.com/zovi-edge-collection?misc_ref_code=hp_seo_text,349,ZOVI EDGE,womens-flats-and-ballerinas,zovi,http://d2zfu6byxx4psc.cloudfront.net/z/prod/w/2/g/p/A137SLF02701/5_c.jpg,349,black,Men,http://zovi.com/black-with-grey-square-design-lightweight-slip-on-shoes--A137SLF02701,zovi.com,Zovi Black With Grey Square Design Lightweight Slip-on Shoes - Zovi Womens Flats And Ballerinas,Zovi Black With Grey Square Design Lightweight Slip-on Shoes - Zovi Womens Flats And Ballerinas - Free Shipping. Easy Exchange. 30 Days Returns. Cash on Delivery.,[],<section id="product-detail"> <h2 id="product-title">Black With Grey Square Design Lightweight Slip-on Shoes</h2> <p> Flaunt you femininity and cover those elegant feet in these snug and plush flats. These extremely flexible flats are designed with a black upper with a grey square design and open backs. The heel measures upto 2 cm and the outersole is black in colour. With ethnic or western clothes  these lightweight flats will draw the attention of all surrounding you.</p><b>Material: Upper - Fabric | Sole - PU</b> <label class="care"> Care Instructions<span class="down-arrow"></span> <section id="washcare"> <ul> <li>Wipe surface with soft  clean  dry cloth / sponge to remove dust.</li> <li>Do not machine wash.</li> </ul> </section> </label> </section>,,14:04:2014,
A137SHM44D01,Forest Green Low Cut Casual Sneakers With Singular Red Stripe,http://zovi.com/zovi-edge-collection?misc_ref_code=hp_seo_text,299,ZOVI EDGE,mens-sneakers-shoes,zovi,http://d2zfu6byxx4psc.cloudfront.net/z/prod/w/2/g/p/A137SHM44D01/1_c.jpg,299,green,Men,http://zovi.com/forest-green-low-cut-casual-sneakers-with-singular-red-stripe--A137SHM44D01,zovi.com,Zovi Forest Green Low Cut Casual Sneakers With Singular Red Stripe - Zovi Mens Sneakers Shoes,Zovi Forest Green Low Cut Casual Sneakers With Singular Red Stripe - Zovi Mens Sneakers Shoes - Free Shipping. Easy Exchange. 30 Days Returns. Cash on Delivery.,[],<section id="product-detail"> <h2 id="product-title">Forest Green Low Cut Casual Sneakers With Singular Red Stripe</h2> <p>Born to be young  free and wild in this pair of outrageously cool shoes. This low cut pair has been designed with forest green canvas on the upper  white laces and white stitch details. These shoes have a red faux leather stripe extended onto the quarter. The inner sole has been designed for comfort and stress free movement to give your foot ultimate ease. These plush shoes are best worn with casual attire and sunglasses under the sun.</p><b>Material: Upper - Canvas | Sole - Air Max</b> <label class="care"> Care Instructions<span class="down-arrow"></span> <section id="washcare"> <ul> <li>Always apply the matching color polish to your shoes.</li> <li>Use solvent based suede cleaner to remove stains.</li> <li>Use toothbrush  mild soap and water to clean Sneakers made from canvas.</li> <li>If you are in bit hurry  remove excess dirt with a cloth and/or a brush and then apply the liquid shine evenly to your shoes.</li> <li>To retain the shape of shoes  store them using a shoe tree. In case you don't have shoe tree  stuff the toe cap with newspaper or tissue.</li> <li>Never store leather shoes near direct heat.</li> <li>If your shoes get wet  allow them to dry completely before wearing them again.</li> </ul> </section> </label> </section>,,14:04:2014,
A137SLF02401,Silver With Black Square Design Lightweight Slip-on Shoes,http://zovi.com/zovi-edge-collection?misc_ref_code=hp_seo_text,349,ZOVI EDGE,womens-flats-and-ballerinas,zovi,http://d1n7si5t7mlegv.cloudfront.net/z/prod/w/2/g/p/A137SLF02401/1_c.jpg,349,black,Men,http://zovi.com/silver-with-black-square-design-lightweight-slip-on-shoes--A137SLF02401,zovi.com,Zovi Silver With Black Square Design Lightweight Slip-on Shoes - Zovi Womens Flats And Ballerinas,Zovi Silver With Black Square Design Lightweight Slip-on Shoes - Zovi Womens Flats And Ballerinas - Free Shipping. Easy Exchange. 30 Days Returns. Cash on Delivery.,[],<section id="product-detail"> <h2 id="product-title">Silver With Black Square Design Lightweight Slip-on Shoes</h2> <p> Flaunt you femininity and cover those elegant feet in these snug and plush flats. These extremely flexible flats are designed with a silver upper with a black square design and open backs. The heel measures upto 2 cm and the outersole is black in colour. With ethnic or western clothes  these lightweight flats will draw the attention of all surrounding you.</p><b>Material: Upper - Fabric | Sole - PU</b> <label class="care"> Care Instructions<span class="down-arrow"></span> <section id="washcare"> <ul> <li>Wipe surface with soft  clean  dry cloth / sponge to remove dust.</li> <li>Do not machine wash.</li> </ul> </section> </label> </section>,,14:04:2014,
