00019110501,Black With Royal Blue Phase Sports Shoes,http://zovi.com/zovi-edge-collection?misc_ref_code=hp_seo_text,499,ZOVI EDGE,mens-sports-shoes,zovi,http://d2zfu6byxx4psc.cloudfront.net/z/prod/w/2/g/p/00019110501/1_c.jpg,499,black,Men,http://zovi.com/black-with-royal-blue-phase-sports-shoes--00019110501,zovi.com,Zovi Black With Royal Blue Phase Sports Shoes - Zovi Mens Sports Shoes,Zovi Black With Royal Blue Phase Sports Shoes - Zovi Mens Sports Shoes - Free Shipping. Easy Exchange. 30 Days Returns. Cash on Delivery.,[],<section id="product-detail"> <h2 id="product-title">Black With Royal Blue Phase Sports Shoes</h2> <p>Summer sports need to be supported with shoes that are easy to play in. This low cut pair has been designed with a black upper along with royal blue and silver accents. The inner sole has been designed for comfort and stress free movement to give your foot ultimate ease. These shoes have been created for all round activities  to be worn with tracks and a cotton tee. </p><b>Material: Upper – Synthetic | Sole - EVA</b> <label class="care"> Care Instructions<span class="down-arrow"></span> <section id="washcare"> <ul> <li>Wet wipe with light detergent</li> <li>Machine wash is not reccomended</li> </ul> </section> </label> </section>,,14:04:2014,
00017611501,White  Grey And Cherry Stripes Quarter Sports Shoes,http://zovi.com/zovi-edge-collection?misc_ref_code=hp_seo_text,499,ZOVI EDGE,mens-sports-shoes,zovi,http://d2zfu6byxx4psc.cloudfront.net/z/prod/w/2/g/p/00017611501/1_c.jpg,499,white,Men,http://zovi.com/white-grey-and-cherry-stripes-quarter-sports-shoes--00017611501,zovi.com,Zovi White  Grey And Cherry Stripes Quarter Sports Shoes - Zovi Mens Sports Shoes,Zovi White  Grey And Cherry Stripes Quarter Sports Shoes - Zovi Mens Sports Shoes - Free Shipping. Easy Exchange. 30 Days Returns. Cash on Delivery.,[],<section id="product-detail"> <h2 id="product-title">White  Grey And Cherry Stripes Quarter Sports Shoes</h2> <p>Summer sports need to be supported with shoes that are easy to play in. This low cut pair has been designed with a white upper  with a grey toecap and grey  white and cherry stripes on the quarter. The inner sole has been designed for comfort and stress free movement to give your foot ultimate ease. These shoes have been created for all round activities  to be worn with tracks and a cotton tee. </p><b>Material: Upper – Synthetic | Sole - EVA</b> <label class="care"> Care Instructions<span class="down-arrow"></span> <section id="washcare"> <ul> <li>Wet wipe with light detergent</li> <li>Machine wash is not reccomended</li> </ul> </section> </label> </section>,,14:04:2014,
00019109201,White With Black And Silver Century Sports Shoes,http://zovi.com/zovi-edge-collection?misc_ref_code=hp_seo_text,499,ZOVI EDGE,mens-sports-shoes,zovi,http://d1yvqnuw46gd8y.cloudfront.net/z/prod/w/2/g/p/00019109201/1_c.jpg,499,white,Men,http://zovi.com/white-with-black-and-silver-century-sports-shoes--00019109201,zovi.com,Zovi White With Black And Silver Century Sports Shoes - Zovi Mens Sports Shoes,Zovi White With Black And Silver Century Sports Shoes - Zovi Mens Sports Shoes - Free Shipping. Easy Exchange. 30 Days Returns. Cash on Delivery.,[],<section id="product-detail"> <h2 id="product-title">White With Black And Silver Century Sports Shoes</h2> <p>Summer sports need to be supported with shoes are light weight and easy to play in. This low cut pair has been designed with a white upper  black outer and topline and black and silver accents along with a Zovi logo on the quarter. The inner sole has been designed for comfort and stress free movement to give your foot ultimate ease. These shoes have been created for all round activities  to be worn with tracks and a cotton tee. </p><b>Material: Upper – Synthetic | Sole - EVA</b> <label class="care"> Care Instructions<span class="down-arrow"></span> <section id="washcare"> <ul> <li>Wet wipe with light detergent</li> <li>Machine wash is not reccomended</li> </ul> </section> </label> </section>,,14:04:2014,
A137SHM56F01,Sporty White Shoes With Blue Collar,http://zovi.com/zovi-edge-collection?misc_ref_code=hp_seo_text,499,ZOVI EDGE,mens-sports-shoes,zovi,http://d1n7si5t7mlegv.cloudfront.net/z/prod/w/2/g/p/A137SHM56F01/5_c.jpg,499,blue,Men,http://zovi.com/sporty-white-shoes-with-blue-collar--A137SHM56F01,zovi.com,Zovi Sporty White Shoes With Blue Collar - Zovi Mens Sports Shoes,Zovi Sporty White Shoes With Blue Collar - Zovi Mens Sports Shoes - Free Shipping. Easy Exchange. 30 Days Returns. Cash on Delivery.,[],<section id="product-detail"> <h2 id="product-title">Sporty White Shoes With Blue Collar</h2> <p>The right sport shoes are a must have for comfort and style. These here are grey sports shoes with white lace and grey outersole. The shoe features comfortable cushion for stress free active wear. This pair has a mesh tongue  white mesh outer and a blue collar. The shoes are also designed with maximum grip along the stylized diagonal side accents. Your quest for the trendiest sport shoes are over  with this pair.</p><b>Material: Upper – Synthetic and Mesh | Sole - EVA</b> <label class="care"> Care Instructions<span class="down-arrow"></span> <section id="washcare"> <ul> <li>Wet wipe with light detergent</li> <li>Machine wash is not reccomended</li> </ul> </section> </label> </section>,,14:04:2014,
A137SHM57202,Sporty White Shoes With Silver And Navy Highlights,http://zovi.com/zovi-edge-collection?misc_ref_code=hp_seo_text,499,ZOVI EDGE,mens-sports-shoes,zovi,http://d1n7si5t7mlegv.cloudfront.net/z/prod/w/2/g/p/A137SHM57202/1_c.jpg,499,white,Men,http://zovi.com/sporty-white-shoes-with-silver-and-navy-highlights--A137SHM57202,zovi.com,Zovi Sporty White Shoes With Silver And Navy Highlights - Zovi Mens Sports Shoes,Zovi Sporty White Shoes With Silver And Navy Highlights - Zovi Mens Sports Shoes - Free Shipping. Easy Exchange. 30 Days Returns. Cash on Delivery.,[],<section id="product-detail"> <h2 id="product-title">Sporty White Shoes With Silver And Navy Highlights</h2> <p>The right sport shoes are a must have for comfort and style. These here are white sports shoes with white lace and outersole  and navy and silver highlights. The shoe features comfortable cushion for stress free active wear. The shoes are also designed with maximum grip along the stylized diagonal side accents. Your quest for the trendiest sport shoes are over  with this pair.</p><b>Material: Upper – Synthetic | Sole - EVA</b> <label class="care"> Care Instructions<span class="down-arrow"></span> <section id="washcare"> <ul> <li>Wet wipe with light detergent</li> <li>Machine wash is not reccomended</li> </ul> </section> </label> </section>,,14:04:2014,
00017611401,White  Grey And Black Stripes Quarter Sports Shoes,http://zovi.com/zovi-edge-collection?misc_ref_code=hp_seo_text,499,ZOVI EDGE,mens-sports-shoes,zovi,http://d1yvqnuw46gd8y.cloudfront.net/z/prod/w/2/g/p/00017611401/1_c.jpg,499,white,Men,http://zovi.com/white-grey-and-black-stripes-quarter-sports-shoes--00017611401,zovi.com,Zovi White  Grey And Black Stripes Quarter Sports Shoes - Zovi Mens Sports Shoes,Zovi White  Grey And Black Stripes Quarter Sports Shoes - Zovi Mens Sports Shoes - Free Shipping. Easy Exchange. 30 Days Returns. Cash on Delivery.,[],<section id="product-detail"> <h2 id="product-title">White  Grey And Black Stripes Quarter Sports Shoes</h2> <p>Summer sports need to be supported with shoes that are easy to play in. This low cut pair has been designed with a white upper  with a grey toecap and grey  white and black stripes on the quarter. The inner sole has been designed for comfort and stress free movement to give your foot ultimate ease. These shoes have been created for all round activities  to be worn with tracks and a cotton tee. </p><b>Material: Upper – Synthetic | Sole - EVA</b> <label class="care"> Care Instructions<span class="down-arrow"></span> <section id="washcare"> <ul> <li>Wet wipe with light detergent</li> <li>Machine wash is not reccomended</li> </ul> </section> </label> </section>,,14:04:2014,
A137SHM56C02,Grey Upon White Sport Shoes With Orange Vertical Accents,http://zovi.com/zovi-edge-collection?misc_ref_code=hp_seo_text,499,ZOVI EDGE,mens-sports-shoes,zovi,http://d1yvqnuw46gd8y.cloudfront.net/z/prod/w/2/g/p/A137SHM56C02/5_c.jpg,499,orange,Men,http://zovi.com/grey-upon-white-sport-shoes-with-orange-vertical-accents--A137SHM56C02,zovi.com,Zovi Grey Upon White Sport Shoes With Orange Vertical Accents - Zovi Mens Sports Shoes,Zovi Grey Upon White Sport Shoes With Orange Vertical Accents - Zovi Mens Sports Shoes - Free Shipping. Easy Exchange. 30 Days Returns. Cash on Delivery.,[],<section id="product-detail"> <h2 id="product-title">Grey Upon White Sport Shoes With Orange Vertical Accents</h2> <p>The right sport shoes are a must have for comfort and style. These here are grey and white sports shoes with white lace and white outersole. The shoe features comfortable cushion for stress free active wear. This pair has a mesh tongue  light grey mesh outer and a orange collar. The shoes are also designed with maximum grip along three stylized vertical yellow side accents leading to cloth eyelets. Your quest for the trendiest sport shoes are over  with this pair.</p><b>Material: Upper – Synthetic and Mesh | Sole - EVA</b> <label class="care"> Care Instructions<span class="down-arrow"></span> <section id="washcare"> <ul> <li>Wet wipe with light detergent</li> <li>Machine wash is not reccomended</li> </ul> </section> </label> </section>,,14:04:2014,
00019111901,White With Navy And Green Phase Sports Shoes,http://zovi.com/zovi-edge-collection?misc_ref_code=hp_seo_text,499,ZOVI EDGE,mens-sports-shoes,zovi,http://d1yvqnuw46gd8y.cloudfront.net/z/prod/w/2/g/p/00019111901/1_c.jpg,499,white,Men,http://zovi.com/white-with-navy-and-green-phase-sports-shoes--00019111901,zovi.com,Zovi White With Navy And Green Phase Sports Shoes - Zovi Mens Sports Shoes,Zovi White With Navy And Green Phase Sports Shoes - Zovi Mens Sports Shoes - Free Shipping. Easy Exchange. 30 Days Returns. Cash on Delivery.,[],<section id="product-detail"> <h2 id="product-title">White With Navy And Green Phase Sports Shoes</h2> <p>Summer sports need to be supported with shoes that are easy to play in. This low cut pair has been designed with a white upper along with navy  green and silver accents. The inner sole has been designed for comfort and stress free movement to give your foot ultimate ease. These shoes have been created for all round activities  to be worn with tracks and a cotton tee. </p><b>Material: Upper – Synthetic | Sole - EVA</b> <label class="care"> Care Instructions<span class="down-arrow"></span> <section id="washcare"> <ul> <li>Wet wipe with light detergent</li> <li>Machine wash is not reccomended</li> </ul> </section> </label> </section>,,14:04:2014,
A137SHM57203,Sporty White Shoes With Silver And Green Highlights,http://zovi.com/zovi-edge-collection?misc_ref_code=hp_seo_text,499,ZOVI EDGE,mens-sports-shoes,zovi,http://d1yvqnuw46gd8y.cloudfront.net/z/prod/w/2/g/p/A137SHM57203/1_c.jpg,499,white,Men,http://zovi.com/sporty-white-shoes-with-silver-and-green-highlights--A137SHM57203,zovi.com,Zovi Sporty White Shoes With Silver And Green Highlights - Zovi Mens Sports Shoes,Zovi Sporty White Shoes With Silver And Green Highlights - Zovi Mens Sports Shoes - Free Shipping. Easy Exchange. 30 Days Returns. Cash on Delivery.,[],<section id="product-detail"> <h2 id="product-title">Sporty White Shoes With Silver And Green Highlights</h2> <p>The right sport shoes are a must have for comfort and style. These here are white sports shoes with white lace and outersole  and green and silver highlights. The shoe features comfortable cushion for stress free active wear. The shoes are also designed with maximum grip along the stylized diagonal side accents. Your quest for the trendiest sport shoes are over  with this pair.</p><b>Material: Upper – Synthetic | Sole - EVA</b> <label class="care"> Care Instructions<span class="down-arrow"></span> <section id="washcare"> <ul> <li>Wet wipe with light detergent</li> <li>Machine wash is not reccomended</li> </ul> </section> </label> </section>,,14:04:2014,
A137SHM57201,Sporty Black Shoes With Silver Highlights And Yellow Collar,http://zovi.com/zovi-edge-collection?misc_ref_code=hp_seo_text,499,ZOVI EDGE,mens-sports-shoes,zovi,http://d2zfu6byxx4psc.cloudfront.net/z/prod/w/2/g/p/A137SHM57201/1_c.jpg,499,black,Men,http://zovi.com/sporty-black-shoes-with-silver-highlights-and-yellow-collar--A137SHM57201,zovi.com,Zovi Sporty Black Shoes With Silver Highlights And Yellow Collar - Zovi Mens Sports Shoes,Zovi Sporty Black Shoes With Silver Highlights And Yellow Collar - Zovi Mens Sports Shoes - Free Shipping. Easy Exchange. 30 Days Returns. Cash on Delivery.,[],<section id="product-detail"> <h2 id="product-title">Sporty Black Shoes With Silver Highlights And Yellow Collar</h2> <p>The right sport shoes are a must have for comfort and style. These here are black sports shoes with black laces and white outersole with silver and black highlights and a yellow collar and Zovi logo on the tongue. The shoe features comfortable cushion for stress free active wear. The shoes are also designed with maximum grip along the stylized diagonal side accents. Your quest for the trendiest sport shoes are over  with this pair.</p><b>Material: Upper – Synthetic | Sole - EVA</b> <label class="care"> Care Instructions<span class="down-arrow"></span> <section id="washcare"> <ul> <li>Wet wipe with light detergent</li> <li>Machine wash is not reccomended</li> </ul> </section> </label> </section>,,14:04:2014,
A137SHM56C04,Grey Upon White Sport Shoes With Yellow Vertical Accents,http://zovi.com/zovi-edge-collection?misc_ref_code=hp_seo_text,499,ZOVI EDGE,mens-sports-shoes,zovi,http://d1n7si5t7mlegv.cloudfront.net/z/prod/w/2/g/p/A137SHM56C04/5_c.jpg,499,yellow,Men,http://zovi.com/grey-upon-white-sport-shoes-with-yellow-vertical-accents--A137SHM56C04,zovi.com,Zovi Grey Upon White Sport Shoes With Yellow Vertical Accents - Zovi Mens Sports Shoes,Zovi Grey Upon White Sport Shoes With Yellow Vertical Accents - Zovi Mens Sports Shoes - Free Shipping. Easy Exchange. 30 Days Returns. Cash on Delivery.,[],<section id="product-detail"> <h2 id="product-title">Grey Upon White Sport Shoes With Yellow Vertical Accents</h2> <p>The right sport shoes are a must have for comfort and style. These here are grey and white sports shoes with white lace and white outersole. The shoe features comfortable cushion for stress free active wear. This pair has a mesh tongue  light grey mesh outer and a yellow collar. The shoes are also designed with maximum grip along three stylized vertical yellow side accents leading to cloth eyelets. Your quest for the trendiest sport shoes are over  with this pair.</p><b>Material: Upper – Synthetic and Mesh | Sole - EVA</b> <label class="care"> Care Instructions<span class="down-arrow"></span> <section id="washcare"> <ul> <li>Wet wipe with light detergent</li> <li>Machine wash is not reccomended</li> </ul> </section> </label> </section>,,14:04:2014,
A137SHM15602,Black Red Mesh Sports Shoes,http://zovi.com/zovi-edge-collection?misc_ref_code=hp_seo_text,299,ZOVI EDGE,mens-sports-shoes,zovi,http://d2zfu6byxx4psc.cloudfront.net/z/prod/w/2/g/p/A137SHM15602/1_c.jpg,299,black,Men,http://zovi.com/black-red-mesh-sports-shoes--A137SHM15602,zovi.com,Zovi Black Red Mesh Sports Shoes - Zovi Mens Sports Shoes,Zovi Black Red Mesh Sports Shoes - Zovi Mens Sports Shoes - Free Shipping. Easy Exchange. 30 Days Returns. Cash on Delivery.,[],<section id="product-detail"> <h2 id="product-title">Black Red Mesh Sports Shoes</h2> <p>Casual and comfortable shoes set the pace right. Here are black and yellow sports shoes with comfortable cushion for stress free active wear. The black shoes feature red side accents with a red outersole. The shoes are also designed with maximum grip along the stylized yellow soles. Match your attitude with these trend setting shoes.</p><b>Material: Upper - Mesh and Synthetic | Sole - EVA</b> Care Instructions<span class="down-arrow"></span> <section id="washcare"> <ul> <li>Wet wipe with light detergent</li> <li>Machine wash is not reccomended</li> </ul> </section>  </section>,,14:04:2014,
A133RNM0EC28,Purple Melange Round Neck T-shirt,http://zovi.com/zovi-edge-collection?misc_ref_code=hp_seo_text,249,ZOVI EDGE,mens-fashion-solid-tees,zovi,http://d2zfu6byxx4psc.cloudfront.net/z/prod/w/2/g/p/A133RNM0EC28/1_c.jpg,249,purple,Men,http://zovi.com/purple-melange-round-neck-t-shirt--A133RNM0EC28,zovi.com,Zovi Purple Melange Round Neck T-shirt - Zovi Mens Fashion Solid Tees,Zovi Purple Melange Round Neck T-shirt - Zovi Mens Fashion Solid Tees - Free Shipping. Easy Exchange. 30 Days Returns. Cash on Delivery.,[],<section id="product-detail"> <h2 id="product-title">Purple Melange Round Neck T-shirt</h2> <p>A solid purple melange colour round neck t-shirt for men. The coloured tee features round neck and short sleeves. Style the t-shirt in summer a jacket and loafers with your favourite denims.</p><b>Fabric: 100% Cotton/Polyester</b> <label class="care"> Care Instructions<span class="down-arrow"></span> <section id="washcare"> <ul> <li>Warm wash under 30 C</li> <li>Do not bleach</li> <li>Do not dry clean</li> <li>Do not tumble dry</li> <li>Dry Flat in shade</li> <li>Warm Iron</li> <li>Do not wring</li> </ul> </section> </label> </section>,,14:04:2014,
A133RNM54010,Coffee Brown Round Neck T-shirt,http://zovi.com/zovi-edge-collection?misc_ref_code=hp_seo_text,199,ZOVI EDGE,mens-plain-tees,zovi,http://d2zfu6byxx4psc.cloudfront.net/z/prod/w/2/g/p/A133RNM54010/1_c.jpg,199,brown,Men,http://zovi.com/coffee-brown-round-neck-t-shirt--A133RNM54010,zovi.com,Zovi Coffee Brown Round Neck T-shirt - Zovi Mens Plain Tees,Zovi Coffee Brown Round Neck T-shirt - Zovi Mens Plain Tees - Free Shipping. Easy Exchange. 30 Days Returns. Cash on Delivery.,[],<section id="product-detail"> <h2 id="product-title">Coffee Brown Round Neck T-shirt</h2> <p>A solid coffee brown colour round neck t-shirt for men. The coloured tee features round neck and short sleeves. Style the t-shirt in summer a jacket and loafers with your favourite denims.</p><b>Fabric: 100% Cotton</b> <label class="care"> Care Instructions<span class="down-arrow"></span> <section id="washcare"> <ul> <li>Warm wash under 30 C</li> <li>Do not bleach</li> <li>Do not dry clean</li> <li>Do not tumble dry</li> <li>Dry Flat in shade</li> <li>Warm Iron</li> <li>Do not wring</li> </ul> </section> </label> </section>,,14:04:2014,
A133PLM04B01,Indian Green Solid Polo T-shirt,http://zovi.com/zovi-edge-collection?misc_ref_code=hp_seo_text,349,ZOVI EDGE,mens-solid-polos,zovi,http://d1n7si5t7mlegv.cloudfront.net/z/prod/w/2/g/p/A133PLM04B01/1_c.jpg,349,green,Men,http://zovi.com/indian-green-solid-polo-t-shirt--A133PLM04B01,zovi.com,Zovi Indian Green Solid Polo T-shirt - Zovi Mens Solid Polos,Zovi Indian Green Solid Polo T-shirt - Zovi Mens Solid Polos - Free Shipping. Easy Exchange. 30 Days Returns. Cash on Delivery.,[],<section id="product-detail"> <h2 id="product-title">Indian Green Solid Polo T-shirt</h2> <p> The coolest jock in town could be you! This indian green polo neck t-shirt with half sleeves  has the Zovi logo embroidered on the left chest and a navy inner placket and inner collar band. This classic and trendy polo can be your next choice along with khakis to a music festival.</p><b>Fabric: 100% Cotton <label class="care"> Care Instructions<span class="down-arrow"></span> <section id="washcare"> <ul> <li>Warm wash under 30 C</li> <li>Do not bleach</li> <li>Do not dry clean</li> <li>Do not tumble dry</li> <li>Dry Flat in shade</li> <li>Warm Iron</li> <li>Do not wring</li> </ul> </section> </label> </b></section>,,14:04:2014,
A133RNM53F07,Crimson Red Plain Round Neck T-shirt,http://zovi.com/zovi-edge-collection?misc_ref_code=hp_seo_text,199,ZOVI EDGE,mens-plain-tees,zovi,http://d1n7si5t7mlegv.cloudfront.net/z/prod/w/2/g/p/A133RNM53F07/1_c.jpg,199,red,Men,http://zovi.com/crimson-red-plain-round-neck-t-shirt--A133RNM53F07,zovi.com,Zovi Crimson Red Plain Round Neck T-shirt - Zovi Mens Plain Tees,Zovi Crimson Red Plain Round Neck T-shirt - Zovi Mens Plain Tees - Free Shipping. Easy Exchange. 30 Days Returns. Cash on Delivery.,[],<section id="product-detail"> <h2 id="product-title">Crimson Red Plain Round Neck T-shirt</h2> <p>A round neck t-shirt in crimson red colour. The T-shirt features short sleeves and ribbing detail at sleeve bands and neckline. Style the tee with dark blue denims for a casual outing.</p><b>Fabric: 100% Cotton</b> <label class="care"> Care Instructions<span class="down-arrow"></span> <section id="washcare"> <ul> <li>Warm wash under 30 C</li> <li>Do not bleach</li> <li>Do not dry clean</li> <li>Do not tumble dry</li> <li>Dry Flat in shade</li> <li>Warm Iron</li> <li>Do not wring</li> </ul> </section> </label> </section>,,14:04:2014,
S143RNM18601,Gorilla Crimson Red Graphic T-shirt,http://zovi.com/zovi-edge-collection?misc_ref_code=hp_seo_text,399,ZOVI EDGE,mens-graphic-round-necks,zovi,http://d1n7si5t7mlegv.cloudfront.net/z/prod/w/2/g/p/S143RNM18601/1_c.jpg,399,red,Men,http://zovi.com/gorilla-crimson-red-graphic-t-shirt--S143RNM18601,zovi.com,Zovi Gorilla Crimson Red Graphic T-shirt - Zovi Mens Graphic Round Necks,Zovi Gorilla Crimson Red Graphic T-shirt - Zovi Mens Graphic Round Necks - Free Shipping. Easy Exchange. 30 Days Returns. Cash on Delivery.,[],<section id="product-detail"> <h2 id="product-title">Gorilla Crimson Red Graphic T-shirt</h2> <p>Don't shy away from being a daredevil. Tee up with this crimson red; round neck; half sleeves; cotton t-shirt with a Gorilla graphic print and other imagery. Tuck in or tuck out with jeans and flip flops for a naughty time out with the boys.</p><b>Fabric: 100% Cotton</b> <label class="care"> Care Instructions<span class="down-arrow"></span> <section id="washcare"> <ul> <li>Warm wash under 30 C</li> <li>Do not bleach</li> <li>Do not dry clean</li> <li>Do not tumble dry</li> <li>Dry Flat in shade</li> <li>Warm Iron</li> <li>Do not wring</li> </ul> </section> </label> </section>,,14:04:2014,
A137SHM57501,Sporty White Shoes With Black And Silver Features,http://zovi.com/zovi-edge-collection?misc_ref_code=hp_seo_text,499,ZOVI EDGE,mens-sports-shoes,zovi,http://d1yvqnuw46gd8y.cloudfront.net/z/prod/w/2/g/p/A137SHM57501/5_c.jpg,499,white,Men,http://zovi.com/sporty-white-shoes-with-black-and-silver-features--A137SHM57501,zovi.com,Zovi Sporty White Shoes With Black And Silver Features - Zovi Mens Sports Shoes,Zovi Sporty White Shoes With Black And Silver Features - Zovi Mens Sports Shoes - Free Shipping. Easy Exchange. 30 Days Returns. Cash on Delivery.,[],<section id="product-detail"> <h2 id="product-title">Sporty White Shoes With Black And Silver Features</h2> <p>The right sport shoes are a must have for comfort and style. These here are white sports shoes with white lace and black outersole; with sporty and fierce features on the quarter in black and silver and writing on the body of the shoe. The shoe features comfortable cushion for stress free active wear. The shoes are also designed with maximum grip along the stylized diagonal side accents. Your quest for the trendiest sport shoes are over; with this pair.</p><b>Material: Upper Synthetic | Sole - EVA</b> <label class="care"> Care Instructions<span class="down-arrow"></span> <section id="washcare"> <ul> <li>Wet wipe with light detergent</li> <li>Machine wash is not reccomended</li> </ul> </section> </label> </section>,,14:04:2014,
S147SHM05801,Ebony Black Lush Sports Shoes With Velcro Straps,http://zovi.com/zovi-edge-collection?misc_ref_code=hp_seo_text,499,ZOVI EDGE,mens-sports-shoes,zovi,http://d2zfu6byxx4psc.cloudfront.net/z/prod/w/2/g/p/S147SHM05801/1_c.jpg,499,black,Men,http://zovi.com/ebony-black-lush-sports-shoes-with-velcro-straps--S147SHM05801,zovi.com,Zovi Ebony Black Lush Sports Shoes With Velcro Straps - Zovi Mens Sports Shoes,Zovi Ebony Black Lush Sports Shoes With Velcro Straps - Zovi Mens Sports Shoes - Free Shipping. Easy Exchange. 30 Days Returns. Cash on Delivery.,[],<section id="product-detail"> <h2 id="product-title">Ebony Black Lush Sports Shoes With Velcro Straps</h2> <p>Enhance your performance while not compromising on style and comfort with a pair of exciting new sport shoes. This low cut pair has been designed with a highly modified and aesthetic ebony black upper  grey stripes on the quarter and outer collar and velcro straps. The inner sole has been designed for comfort and stress free movement to give your foot ultimate ease. Jet  set  go in these lush shoes along with tracks and a tee  bound toward your next sporty adventure.</p><b>Material: Upper - Synthetic | Sole - Double Colour TPR</b> <label class="care"> Care Instructions<span class="down-arrow"></span> <section id="washcare"> <ul> <li>Wet wipe with light detergent</li> <li>Machine wash is not reccomended</li> </ul> </section> </label> </section>,,14:04:2014,
