A123PLB00301,Red With Army Thunder Bolt Print Single Jersey Polo,http://zovi.com/boys-polos?misc_ref_code=hp_seo_text,297,POLOS,boys-polos,zovi,http://d1n7si5t7mlegv.cloudfront.net/z/prod/w/2/g/p/A123PLB00301/1_c.jpg,297,,Boys,http://zovi.com/red-with-army-thunder-bolt-print-single-jersey-polo--A123PLB00301,zovi.com,Zovi Red With Army Thunder Bolt Print Single Jersey Polo - Zovi Boys Polos,Zovi Red With Army Thunder Bolt Print Single Jersey Polo - Zovi Boys Polos - Free Shipping. Easy Exchange. 30 Days Returns. Cash on Delivery.,['6-7 Y'  '7-8 Y'  '8-9 Y'],<section id="product-detail"> <h2 id="product-title">Red With Army Thunder Bolt Print Single Jersey Polo</h2> <p> A smart chest print boy's polo. The polo t-shirt features short sleeves and a front centre placed print with embroidery on left chest. This boy's polo has white placket; collar and sleeve cuffs </p><b>Fabric: 100% Cotton; Single Jersey; 180 GSM </b> <label class="care"> Care Instructions<span class="down-arrow"></span> <section id="washcare"> <ul> <li>Warm wash under 30 C</li> <li>Do not bleach</li> <li>Do not dry clean</li> <li>Do not tumble dry</li> <li>Dry Flat in shade</li> <li>Warm Iron</li> <li>Do not wring</li> </ul> </section> </label> </section>,,14:04:2014,
A123PLB00201,Blue Embroidered Badge Polo,http://zovi.com/boys-polos?misc_ref_code=hp_seo_text,251,POLOS,boys-polos,zovi,http://d1yvqnuw46gd8y.cloudfront.net/z/prod/w/2/g/p/A123PLB00201/1_c.jpg,251,,Boys,http://zovi.com/blue-embroidered-badge-polo--A123PLB00201,zovi.com,Zovi Blue Embroidered Badge Polo - Zovi Boys Polos,Zovi Blue Embroidered Badge Polo - Zovi Boys Polos - Free Shipping. Easy Exchange. 30 Days Returns. Cash on Delivery.,['8-9 Y'  '7-8 Y'],<section id="product-detail"> <h2 id="product-title">Blue Embroidered Badge Polo</h2> <p> A trendy value added solid blue colour boy's polo t-shirt. This cool stylish polo features bright blue colour with puckered button placket. The inner placket of the polo is in contrast red colour and has a trendy striped tape at inner collar. An embroidered badge is placed at left chest and the polo has flat knit at sleeve cuffs and collar.</p><b>Fabric: 100% Cotton; Single Jersey; 180 GSM </b> <label class="care"> Care Instructions<span class="down-arrow"></span> <section id="washcare"> <ul> <li>Warm wash under 30 C</li> <li>Do not bleach</li> <li>Do not dry clean</li> <li>Do not tumble dry</li> <li>Dry Flat in shade</li> <li>Warm Iron</li> <li>Do not wring</li> </ul> </section> </label> </section>,,14:04:2014,
A123PLB00302,Navy With Army Thunder Bolt Print Single Jersey Polo,http://zovi.com/boys-polos?misc_ref_code=hp_seo_text,314,POLOS,boys-polos,zovi,http://d1n7si5t7mlegv.cloudfront.net/z/prod/w/2/g/p/A123PLB00302/1_c.jpg,314,,Boys,http://zovi.com/navy-with-army-thunder-bolt-print-single-jersey-polo--A123PLB00302,zovi.com,Zovi Navy With Army Thunder Bolt Print Single Jersey Polo - Zovi Boys Polos,Zovi Navy With Army Thunder Bolt Print Single Jersey Polo - Zovi Boys Polos - Free Shipping. Easy Exchange. 30 Days Returns. Cash on Delivery.,['7-8 Y'  '8-9 Y'],<section id="product-detail"> <h2 id="product-title">Navy With Army Thunder Bolt Print Single Jersey Polo</h2> <p> A smart chest print boy's polo. The polo t-shirt features short sleeves and a front centre placed print with embroidery on left chest. This boy's polo has white placket; collar and sleeve cuffs </p><b>Fabric: 100% Cotton; Single Jersey; 180 GSM </b> <label class="care"> Care Instructions<span class="down-arrow"></span> <section id="washcare"> <ul> <li>Warm wash under 30 C</li> <li>Do not bleach</li> <li>Do not dry clean</li> <li>Do not tumble dry</li> <li>Dry Flat in shade</li> <li>Warm Iron</li> <li>Do not wring</li> </ul> </section> </label> </section>,,14:04:2014,
A123PLB00701,Navy And Yellow Striped Pique Polo,http://zovi.com/boys-polos?misc_ref_code=hp_seo_text,339,POLOS,boys-polos,zovi,http://d2zfu6byxx4psc.cloudfront.net/z/prod/w/2/g/p/A123PLB00701/1_c.jpg,339,,Boys,http://zovi.com/navy-and-yellow-striped-pique-polo--A123PLB00701,zovi.com,Zovi Navy And Yellow Striped Pique Polo - Zovi Boys Polos,Zovi Navy And Yellow Striped Pique Polo - Zovi Boys Polos - Free Shipping. Easy Exchange. 30 Days Returns. Cash on Delivery.,['11-12 Y'  '8-9 Y'  '10-11 Y'  '7-8 Y'  '6-7 Y'],<section id="product-detail"> <h2 id="product-title">Navy And Yellow Striped Pique Polo</h2> <p> A classic boy's stripe polo. The polo feature short sleeves and basic stripes. And the polo has flat knit details at collar sleeve cuffs and button placket.</p><b>Fabric: 100% Cotton. Pique; 210 GSM </b> <label class="care"> Care Instructions<span class="down-arrow"></span> <section id="washcare"> <ul> <li>Warm wash under 30 C</li> <li>Do not bleach</li> <li>Do not dry clean</li> <li>Do not tumble dry</li> <li>Dry Flat in shade</li> <li>Warm Iron</li> <li>Do not wring</li> </ul> </section> </label> </section>,,14:04:2014,
A123PLB00702,Navy And Blue Striped Pique Polo,http://zovi.com/boys-polos?misc_ref_code=hp_seo_text,339,POLOS,boys-polos,zovi,http://d2zfu6byxx4psc.cloudfront.net/z/prod/w/2/g/p/A123PLB00702/1_c.jpg,339,,Boys,http://zovi.com/navy-and-blue-striped-pique-polo--A123PLB00702,zovi.com,Zovi Navy And Blue Striped Pique Polo - Zovi Boys Polos,Zovi Navy And Blue Striped Pique Polo - Zovi Boys Polos - Free Shipping. Easy Exchange. 30 Days Returns. Cash on Delivery.,['6-7 Y'  '7-8 Y'  '8-9 Y'  '10-11 Y'],<section id="product-detail"> <h2 id="product-title">Navy And Blue Striped Pique Polo</h2> <p> A classic boy's stripe polo. The polo feature short sleeves and basic stripes. And the polo has flat knit details at collar sleeve cuffs and button placket.</p><b>Fabric: 100% Cotton. Pique; 210 GSM</b> <label class="care"> Care Instructions<span class="down-arrow"></span> <section id="washcare"> <ul> <li>Warm wash under 30 C</li> <li>Do not bleach</li> <li>Do not dry clean</li> <li>Do not tumble dry</li> <li>Dry Flat in shade</li> <li>Warm Iron</li> <li>Do not wring</li> </ul> </section> </label> </section>,,14:04:2014,
A123PLB00202,Red Embroidered Badge Polo,http://zovi.com/boys-polos?misc_ref_code=hp_seo_text,251,POLOS,boys-polos,zovi,http://d2zfu6byxx4psc.cloudfront.net/z/prod/w/2/g/p/A123PLB00202/1_c.jpg,251,,Boys,http://zovi.com/red-embroidered-badge-polo--A123PLB00202,zovi.com,Zovi Red Embroidered Badge Polo - Zovi Boys Polos,Zovi Red Embroidered Badge Polo - Zovi Boys Polos - Free Shipping. Easy Exchange. 30 Days Returns. Cash on Delivery.,['7-8 Y'],<section id="product-detail"> <h2 id="product-title">Red Embroidered Badge Polo</h2> <p> A trendy value added solid red colour boy's polo t-shirt. This cool stylish polo features bright red colour with puckered button placket. The inner placket of the polo is in contrast blue colour and has a trendy striped tape at inner collar. An embroidered badge is placed at left chest and the polo has flat knit at sleeve cuffs and collar.</p><b>Fabric: 100% Cotton; Single Jersey; 180 GSM </b> <label class="care"> Care Instructions<span class="down-arrow"></span> <section id="washcare"> <ul> <li>Warm wash under 30 C</li> <li>Do not bleach</li> <li>Do not dry clean</li> <li>Do not tumble dry</li> <li>Dry Flat in shade</li> <li>Warm Iron</li> <li>Do not wring</li> </ul> </section> </label> </section>,,14:04:2014,
A123PLB00402,Green With Blue Diagonal Panel Single Jersey Polo,http://zovi.com/boys-polos?misc_ref_code=hp_seo_text,297,POLOS,boys-polos,zovi,http://d1n7si5t7mlegv.cloudfront.net/z/prod/w/2/g/p/A123PLB00402/1_c.jpg,297,,Boys,http://zovi.com/green-with-blue-diagonal-panel-single-jersey-polo--A123PLB00402,zovi.com,Zovi Green With Blue Diagonal Panel Single Jersey Polo - Zovi Boys Polos,Zovi Green With Blue Diagonal Panel Single Jersey Polo - Zovi Boys Polos - Free Shipping. Easy Exchange. 30 Days Returns. Cash on Delivery.,['6-7 Y'  '7-8 Y'  '8-9 Y'],<section id="product-detail"> <h2 id="product-title">Green With Blue Diagonal Panel Single Jersey Polo</h2> <p>A casual smart polo for boys. The short sleeve stylized polo features contrast colour diagonal panel running across the chest and contrast colour collar and sleeves. This boy's polo has a 11 print on the right chest and olive leaf print on left.</p><b>Fabric: 100% Cotton; Single Jersey; 180 GSM </b> <label class="care"> Care Instructions<span class="down-arrow"></span> <section id="washcare"> <ul> <li>Warm wash under 30 C</li> <li>Do not bleach</li> <li>Do not dry clean</li> <li>Do not tumble dry</li> <li>Dry Flat in shade</li> <li>Warm Iron</li> <li>Do not wring</li> </ul> </section> </label> </section>,,14:04:2014,
A123PLB00401,Yellow With Blue Diagonal Panel Single Jersey Polo,http://zovi.com/boys-polos?misc_ref_code=hp_seo_text,297,POLOS,boys-polos,zovi,http://d1n7si5t7mlegv.cloudfront.net/z/prod/w/2/g/p/A123PLB00401/1_c.jpg,297,,Boys,http://zovi.com/yellow-with-blue-diagonal-panel-single-jersey-polo--A123PLB00401,zovi.com,Zovi Yellow With Blue Diagonal Panel Single Jersey Polo - Zovi Boys Polos,Zovi Yellow With Blue Diagonal Panel Single Jersey Polo - Zovi Boys Polos - Free Shipping. Easy Exchange. 30 Days Returns. Cash on Delivery.,['7-8 Y'],<section id="product-detail"> <h2 id="product-title">Yellow With Blue Diagonal Panel Single Jersey Polo</h2> <p>A casual smart polo for boys. The short sleeve stylized polo features contrast colour diagonal panel running across the chest and contrast colour collar and sleeves. This boy's polo has a 11 print on the right chest and olive leaf print on left.</p><b>Fabric: 100% Cotton; Single Jersey; 180 GSM </b> <label class="care"> Care Instructions<span class="down-arrow"></span> <section id="washcare"> <ul> <li>Warm wash under 30 C</li> <li>Do not bleach</li> <li>Do not dry clean</li> <li>Do not tumble dry</li> <li>Dry Flat in shade</li> <li>Warm Iron</li> <li>Do not wring</li> </ul> </section> </label> </section>,,14:04:2014,
A123PLB00703,Navy And Pink Striped Pique Polo,http://zovi.com/boys-polos?misc_ref_code=hp_seo_text,339,POLOS,boys-polos,zovi,http://d2zfu6byxx4psc.cloudfront.net/z/prod/w/2/g/p/A123PLB00703/1_c.jpg,339,,Boys,http://zovi.com/navy-and-pink-striped-pique-polo--A123PLB00703,zovi.com,Zovi Navy And Pink Striped Pique Polo - Zovi Boys Polos,Zovi Navy And Pink Striped Pique Polo - Zovi Boys Polos - Free Shipping. Easy Exchange. 30 Days Returns. Cash on Delivery.,['6-7 Y'  '7-8 Y'  '8-9 Y'  '10-11 Y'  '11-12 Y'],<section id="product-detail"> <h2 id="product-title">Navy And Pink Striped Pique Polo</h2> <p> A classic boy's stripe polo. The polo feature short sleeves and basic stripes. And the polo has flat knit details at collar sleeve cuffs and button placket.</p><b>Fabric: 100% Cotton. Pique; 210 GSM </b> <label class="care"> Care Instructions<span class="down-arrow"></span> <section id="washcare"> <ul> <li>Warm wash under 30 C</li> <li>Do not bleach</li> <li>Do not dry clean</li> <li>Do not tumble dry</li> <li>Dry Flat in shade</li> <li>Warm Iron</li> <li>Do not wring</li> </ul> </section> </label> </section>,,14:04:2014,
